lid,created_at,lName,lEmail,lCountry,lType,lAmount,lPurpose,uuid,lCategory
13,2023-11-19 09:04:37.036715+00,Silvio,silviotroiani24@gmail.com,Italia,Housing Loan,3000,Consolidamento capitale per sicurezza economica,4593c662-7dac-421a-8dbf-45c1406bab64,Personal
14,2023-11-20 09:59:12.211953+00,Silvio.Troiani,silviotroiani24@gmail.com,Italia,Micro Loan,3000,Consolidamento finanziario per motivi familiari,4593c662-7dac-421a-8dbf-45c1406bab64,Personal
15,2023-11-22 10:30:45.972792+00,SILVIO,silviotroiani@libero.it,italia,Micro Loan,3000,consolidamento fondi per acquisti,4593c662-7dac-421a-8dbf-45c1406bab64,Personal
16,2023-12-04 14:36:42.160406+00,Silvlo,silviotroiani24@gmail.com,Italia,Micro Loan,3000,Consolidamento credito per sicurezza,4593c662-7dac-421a-8dbf-45c1406bab64,Personal
17,2024-01-16 20:32:21.581576+00,jessie,jaywjack69@gmail.com,canada,Other,720,to cash out my deposit and get my account credited with the cash that is reserved for me to take out,85442b4e-8335-452d-bb88-15895dbf5e80,Personal
18,2024-01-16 23:30:47.032224+00,jessie,jaywjack69@gmail.com,canada,Micro Loan,720,to get my cryptocurrencies out of the holdingsand to use it on myself,85442b4e-8335-452d-bb88-15895dbf5e80,Investment
19,2024-01-26 14:57:50.706387+00,John Jensen,jilj48@gmail.com,Denmark,Other,1000,in order to pay for UNLOCK of my (€82480.00 CCBANK account 0196652,9f523410-4f38-49e9-9775-62c5321e010f,Personal